{"conditions":[{"first_action_agreement":1.0,"inject":1,"repeated_failure_rate":0.0,"sessions":[{"session_id":"session-01","task_count":1,"tool_call_count":1},{"session_id":"session-02","task_count":1,"tool_call_count":1},{"session_id":"session-03","task_count":1,"tool_call_count":1},{"session_id":"session-04","task_count":1,"tool_call_count":1},{"session_id":"session-05","task_count":1,"tool_call_count":1}],"skipped":false,"task_count":5,"tool_call_count":5},{"first_action_agreement":0.0,"inject":0,"repeated_failure_rate":1.0,"sessions":[{"session_id":"session-01","task_count":1,"tool_call_count":1},{"session_id":"session-02","task_count":1,"tool_call_count":1},{"session_id":"session-03","task_count":1,"tool_call_count":1},{"session_id":"session-04","task_count":1,"tool_call_count":1},{"session_id":"session-05","task_count":1,"tool_call_count":1}],"skipped":false,"task_count":5,"tool_call_count":5}],"generated_at":"2026-06-01T00:00:00Z","model_id":"recorded-stub-v1","schema_version":1,"skipped":false,"task_count":5,"tool_call_count":10}
